{
  "apiVersion": "platform.ci/v1",
  "kind": "Application",
  "metadata": {
    "name": "platform-smoke-api",
    "owner": "platform-engineering"
  },
  "spec": {
    "sourcePath": "enterprise-cicd/testing/e2e/platform-smoke-api",
    "buildProfile": "python/python-uv-v1",
    "artifact": {
      "type": "container",
      "repository": "apps/platform-smoke-api"
    },
    "deployment": {
      "type": "kubernetes",
      "releaseProfile": "rolling/rolling-v1"
    }
  }
}
